{
  "schema_version": 1,
  "view": "trace",
  "locale": "ko-KR",
  "title": "요구사항 추적 맵",
  "nodes": [
    {
      "id": "DE-13-001",
      "kind": "test",
      "label": "기간별 조회를 검증한다",
      "technical_label": "EnergyUsageServiceTest.periodRange",
      "status": "review",
      "evidence": [
        {
          "kind": "inferred"
        }
      ]
    },
    {
      "id": "AN-02-001",
      "kind": "requirement",
      "label": "에너지 사용량을 기간별로 조회한다",
      "technical_label": "/api/v1/energy?<script>alert(1)</script>",
      "status": "verified",
      "evidence": [
        {
          "file": "gx-trace.valid.json",
          "line": 1,
          "kind": "artifact"
        }
      ]
    },
    {
      "id": "AN-03-001",
      "kind": "function",
      "label": "기간별 사용량 조회",
      "technical_label": "EnergyUsageService.findByPeriod",
      "status": "in_progress",
      "evidence": []
    }
  ],
  "edges": [
    {
      "id": "AN-03-001->DE-13-001",
      "source": "AN-03-001",
      "target": "DE-13-001",
      "relation": "verified_by"
    },
    {
      "id": "AN-02-001->AN-03-001",
      "source": "AN-02-001",
      "target": "AN-03-001",
      "relation": "realized_by"
    }
  ],
  "meta": {
    "project": "gx-visualize-test"
  }
}
